{"$schema":"https://json-schema.org/draft/2020-12/schema","title":"WordPress Context Evidence","type":"object","additionalProperties":false,"required":["record_kind","schema_version","evidence_id","collection_status","wordpress_version_status","theme_status","plugin_status","user_role_status","source_ref","limitations","not_proven_by_evidence"],"properties":{"record_kind":{"const":"wordpress_context_evidence"},"schema_version":{"type":"string","minLength":1},"evidence_id":{"type":"string","minLength":1},"collection_status":{"type":"object","additionalProperties":false,"required":["status"],"properties":{"status":{"enum":["not_provided","declared_not_available","provided_unvalidated","provided_schema_valid","implemented_awaiting_fixture_validation","validated_fixture","collected_runtime_evidence","rejected_invalid","insufficient_evidence","not_applicable_with_reason"]},"reason":{"type":"string","minLength":1},"ref":{"type":"string","minLength":1},"details":{"type":"string","minLength":1}}},"source_ref":{"type":"object","additionalProperties":false,"required":["source_kind","source_id","observed_at"],"properties":{"source_kind":{"enum":["fixture_sample","external_exporter","browser_collector","manual_declaration","not_available_declaration"]},"source_id":{"type":"string","minLength":1},"observed_at":{"type":"string","minLength":1},"producer_ref":{"type":"string","minLength":1}}},"limitations":{"type":"array","items":{"type":"string","minLength":1},"minItems":1},"not_proven_by_evidence":{"type":"array","items":{"enum":["production_ready","builder_executed","downstream_contract_enforced","official_docs_fully_covered","cross_repo_integrated","project_gate_integrated","runtime_validated"]},"minItems":1},"assertions":{"type":"array","items":{"type":"string","minLength":1}},"wordpress_version_status":{"type":"object","additionalProperties":false,"required":["status"],"properties":{"status":{"enum":["not_provided","declared_not_available","provided_unvalidated","provided_schema_valid","implemented_awaiting_fixture_validation","validated_fixture","collected_runtime_evidence","rejected_invalid","insufficient_evidence","not_applicable_with_reason"]},"reason":{"type":"string","minLength":1},"ref":{"type":"string","minLength":1},"details":{"type":"string","minLength":1}}},"theme_status":{"type":"object","additionalProperties":false,"required":["status"],"properties":{"status":{"enum":["not_provided","declared_not_available","provided_unvalidated","provided_schema_valid","implemented_awaiting_fixture_validation","validated_fixture","collected_runtime_evidence","rejected_invalid","insufficient_evidence","not_applicable_with_reason"]},"reason":{"type":"string","minLength":1},"ref":{"type":"string","minLength":1},"details":{"type":"string","minLength":1}}},"plugin_status":{"type":"object","additionalProperties":false,"required":["status"],"properties":{"status":{"enum":["not_provided","declared_not_available","provided_unvalidated","provided_schema_valid","implemented_awaiting_fixture_validation","validated_fixture","collected_runtime_evidence","rejected_invalid","insufficient_evidence","not_applicable_with_reason"]},"reason":{"type":"string","minLength":1},"ref":{"type":"string","minLength":1},"details":{"type":"string","minLength":1}}},"user_role_status":{"type":"object","additionalProperties":false,"required":["status"],"properties":{"status":{"enum":["not_provided","declared_not_available","provided_unvalidated","provided_schema_valid","implemented_awaiting_fixture_validation","validated_fixture","collected_runtime_evidence","rejected_invalid","insufficient_evidence","not_applicable_with_reason"]},"reason":{"type":"string","minLength":1},"ref":{"type":"string","minLength":1},"details":{"type":"string","minLength":1}}}}}
