{"record_kind":"wordpress_context_evidence","schema_version":"0.5.0","evidence_id":"wp-context-fixture-declared-not-available","collection_status":{"status":"declared_not_available","reason":"No WordPress export was provided for this fixture."},"wordpress_version_status":{"status":"declared_not_available","reason":"Not available in fixture."},"theme_status":{"status":"declared_not_available","reason":"Not available in fixture."},"plugin_status":{"status":"declared_not_available","reason":"Not available in fixture."},"user_role_status":{"status":"declared_not_available","reason":"Not available in fixture."},"source_ref":{"source_kind":"not_available_declaration","source_id":"fixture:no-wordpress-context","observed_at":"2026-07-08T00:00:00Z"},"limitations":["This fixture records absence of evidence only."],"not_proven_by_evidence":["production_ready","builder_executed","downstream_contract_enforced","official_docs_fully_covered","cross_repo_integrated","project_gate_integrated"]}
